plato-research|2026-04-17T20:57:16Z|2026-04-26T17:04:20Z|🔬 PLATO research notes and experiments|HTML|false|false
observatory|2026-04-20T08:41:31Z|2026-04-26T17:03:07Z|Cocapn fleet crate: observatory|N/A|false|false
horizon|2026-04-20T08:41:34Z|2026-04-26T17:02:56Z|Cocapn fleet crate: horizon|N/A|false|false
git-native-mud|2026-04-14T18:11:48Z|2026-04-26T17:02:51Z|🔮 The repo IS the world. Commits ARE actions. Zero server MUD.|Python|false|false
git-agent-minimum|2026-04-15T00:58:26Z|2026-04-26T17:02:49Z|Minimum viable git-agent template — bare bones, boot and self-improve|N/A|false|false
garden|2026-04-20T08:41:27Z|2026-04-26T17:02:48Z|Cocapn fleet crate: garden|N/A|false|false
fleet-logs|2026-04-14T19:16:00Z|2026-04-26T17:02:41Z|📋 Fleet activity logs — hourly beachcomb reports from across the fleet.|N/A|false|false
fleet-daily|2026-04-14T19:15:58Z|2026-04-26T17:02:35Z|📰 Cocapn Fleet Daily — tech news from the bridge. AI crew reports, fleet dispatches, live operations dashboard.|N/A|false|false
dry-dock|2026-04-20T08:41:29Z|2026-04-26T17:02:32Z|Cocapn fleet crate: dry-dock|N/A|false|false
dojo-scout|2026-04-15T01:00:36Z|2026-04-26T17:02:28Z|Dojo agent — self-improving git-agent|Shell|false|false
ct-api-reference|2026-04-14T18:15:17Z|2026-04-26T17:02:19Z|⚒️ Constraint Theory Core API Reference — comprehensive guide to constraint-theory-core v1.0.1|N/A|false|false
crab-traps-audit|2026-04-22T22:18:48Z|2026-04-26T17:02:16Z|Audit report from Plato Server play-test by CCC subagents. Covers real infrastructure testing on Oracle Cloud ARM instance.|N/A|false|false
cocapn-worldmodel|2026-04-20T09:50:02Z|2026-04-26T17:02:09Z|Cocapn fleet crate: cocapn-worldmodel|N/A|false|false
cocapn-workshop|2026-04-20T08:45:19Z|2026-04-26T17:02:07Z|Cocapn fleet crate: cocapn-workshop|N/A|false|false
cocapn-platonic-dial|2026-04-20T09:41:27Z|2026-04-26T17:02:05Z|Cocapn fleet crate: cocapn-platonic-dial|N/A|false|false
cocapn-observatory|2026-04-20T08:45:27Z|2026-04-26T17:02:04Z|Cocapn fleet crate: cocapn-observatory|N/A|false|false
cocapn-nas|2026-04-20T09:50:06Z|2026-04-26T17:02:02Z|Cocapn fleet crate: cocapn-nas|N/A|false|false
cocapn-meta-lab|2026-04-20T09:41:24Z|2026-04-26T17:02:00Z|Cocapn fleet crate: cocapn-meta-lab|N/A|false|false
cocapn-horizon|2026-04-20T08:45:28Z|2026-04-26T17:01:59Z|Cocapn fleet crate: cocapn-horizon|N/A|false|false
cocapn-garden|2026-04-20T08:45:23Z|2026-04-26T17:01:57Z|Cocapn fleet crate: cocapn-garden|N/A|false|false
cocapn-fleetmind|2026-04-20T09:41:25Z|2026-04-26T17:01:55Z|Cocapn fleet crate: cocapn-fleetmind|N/A|false|false
cocapn-dry-dock|2026-04-20T08:45:25Z|2026-04-26T17:01:54Z|Cocapn fleet crate: cocapn-dry-dock|N/A|false|false
cocapn-dreamer|2026-04-20T09:50:00Z|2026-04-26T17:01:52Z|Cocapn fleet crate: cocapn-dreamer|N/A|false|false
cocapn-curriculum-forest|2026-04-20T09:41:21Z|2026-04-26T17:01:48Z|Cocapn fleet crate: cocapn-curriculum-forest|N/A|false|false
cocapn-coliseum|2026-04-20T09:41:17Z|2026-04-26T17:01:47Z|Cocapn fleet crate: cocapn-coliseum|N/A|false|false
cocapn-audit|2026-04-20T09:50:04Z|2026-04-26T17:01:45Z|Cocapn fleet crate: cocapn-audit|N/A|false|false
cocapn-archives|2026-04-20T08:45:21Z|2026-04-26T17:01:43Z|Cocapn fleet crate: cocapn-archives|N/A|false|false
cocapn-abyss|2026-04-20T09:41:16Z|2026-04-26T17:01:42Z|Cocapn fleet crate: cocapn-abyss|N/A|false|false
archives|2026-04-20T08:41:25Z|2026-04-26T17:01:28Z|Cocapn fleet crate: archives|N/A|false|false
cocapn-explain|2026-04-21T00:19:04Z|2026-04-25T17:06:03Z|🔍 Agent explainability — decision traces, oversight queue, P0/P1/P2 review|Python|false|false
plato-provenance|2026-04-21T00:16:56Z|2026-04-25T17:06:01Z|🔐 Zero-trust tile provenance — signing, chain verification, trust scoring|Python|false|false
instinct-pipeline|2026-04-21T00:24:59Z|2026-04-25T17:05:59Z|🧠 Instinct compression pipeline — 70B→7B→1B knowledge extraction, distillation, quantization|Python|false|false
deadband-protocol|2026-04-20T02:03:40Z|2026-04-25T17:05:57Z|🚨 Train safe channels, not danger catalogs. P0 blocks danger, P1 finds safe channels, P2 optimizes within.|Python|false|false
flywheel-engine|2026-04-20T02:03:42Z|2026-04-25T17:05:56Z|🔄 The compounding loop: every exchange becomes a tile, tiles inject context, the system gets smarter.|Python|false|false
fleet-formation-protocol|2026-04-21T00:13:48Z|2026-04-25T17:05:55Z|⚓ Fleet Formation Protocol — self-organizing agent groups|Python|false|false
plato-tile-spec|2026-04-18T19:20:20Z|2026-04-25T17:05:54Z|Canonical tile format v2.1 — domain, confidence, belief, provenance, 384-byte binary|Python|false|false
claude-code-vessel|2026-04-12T02:32:43Z|2026-04-24T17:43:59Z|Claude Code workhorse vessel with experience journal and task delegation|Shell|false|false
PersonalLog|2026-01-01T18:50:12Z|2026-04-24T08:57:28Z|Personal logging and tracking application|TypeScript|false|false
quicunnel|2026-01-09T05:05:26Z|2026-04-24T05:22:17Z|High-performance QUIC tunnel with mTLS authentication and automatic reconnection|Makefile|false|false
autoMate|2026-04-23T05:08:06Z|2026-04-22T08:26:51Z|Like Manus, Computer Use Agent(CUA) and Omniparser, we are computer-using agents.AI-driven local automation assistant that uses natural language to make computers work by themselves|Python|true|false
purplepincher.org|2026-04-20T22:06:28Z|2026-04-22T06:03:00Z|Nonprofit umbrella for open-source agentic computing, Plato ecosystem philosophy, and fleet coordination.|HTML|true|false
agent-skills-affyossmani|2026-04-21T19:12:54Z|2026-04-21T06:34:32Z|Production-grade engineering skills for AI coding agents.|Shell|true|false
jetsonclaw1-onboarding|2026-04-10T23:46:44Z|2026-04-20T22:07:52Z|⚡ Onboarding kit for JetsonClaw1 — Lucineer Vessel Git-Agent|N/A|false|false
holodeck-studio|2026-04-12T07:44:00Z|2026-04-20T15:34:05Z|Holodeck Studio — where ideas actualize. Rooms execute in the real world. The MUD is the interface to everything.|Python|false|false
plato-forge|2026-04-18T19:35:33Z|2026-04-20T06:09:11Z|Fork of Lucineer/plato-forge — PLATO forge, fleet research|Python|true|false
claude-context|2026-04-21T19:07:52Z|2026-04-20T03:29:34Z|Code search MCP for Claude Code. Make entire codebase the context for any coding agent.|TypeScript|true|false
SuperInstance-papers|2026-03-10T05:58:28Z|2026-04-19T19:54:58Z|Automatically Deconstruct logic into Spread Sheet Tiles and Cells, Instances Interconnected w/ Origin-Centric-Math. Breakdown LLMs to Swarms of Artifacts, data, feeds, programs (bots), agents (bots with models), and Seed-Model-Programming (SMPbot), ML tools tiled to any abstraction. Chatbot describes cells for fine tuning + explains how cell works|TypeScript|false|false
flux-instinct|2026-04-12T12:05:24Z|2026-04-19T03:40:33Z|Rust crate — hardwired reflex system: 10 instinct types, priority ordering, history ring buffer|Rust|true|false
businesslog-ai|2026-04-10T07:18:36Z|2026-04-19T03:09:31Z|BusinessLog.ai — AI business operations assistant. Tasks, metrics, decisions. Part of the Lucineer ecosystem.|N/A|true|false
TrendRadar|2026-04-21T19:09:01Z|2026-04-18T23:51:03Z|⭐AI-driven public opinion & trend monitor with multi-platform aggregation, RSS, and smart alerts.🎯 告别信息过载，你的 AI 舆情监控助手与热点筛选工具！聚合多平台热点 +  RSS 订阅，支持关键词精准筛选。AI 智能筛选新闻 + AI 翻译 +  AI 分析简报直推手机，也支持接入 MCP 架构，赋能 AI 自然语言对话分析、情感洞察与趋势预测等。支持 Docker ，数据本地/云端自持。集成微信/飞书/钉钉/Telegram/邮件/ntfy/bark/slack 等渠道智能推送。|Python|true|false
SageAttention|2026-04-18T19:28:45Z|2026-04-18T19:30:25Z|Fleet research: 2-5x faster quantized attention vs FlashAttention — local inference benchmarking for FM RTX 4050 and JC1 Jetson|Cuda|true|false
token-vault|2026-01-09T05:07:26Z|2026-04-18T18:41:20Z|Secure token storage system with AES-256-GCM encryption-at-rest for API keys, secrets, and credentials|Rust|false|false
flux-fuzzer|2026-04-11T13:35:26Z|2026-04-18T18:38:37Z|FLUX bytecode fuzzer — random generation + edge case detection|Python|false|false
flux-spec|2026-04-11T16:56:30Z|2026-04-18T18:38:31Z|FLUX Ecosystem - flux-spec|N/A|false|false
flux-vocabulary|2026-04-11T16:56:32Z|2026-04-18T18:38:24Z|FLUX Ecosystem - flux-vocabulary|Python|false|false
flux-compass|2026-04-12T16:16:09Z|2026-04-18T18:38:20Z|Rust orientation engine: heading, angular velocity, direction|Rust|true|false
flux-coverage|2026-04-11T15:53:20Z|2026-04-18T18:38:17Z|FLUX coverage analyzer — instruction, branch, path, and register coverage|Python|false|false
flux-testkit|2026-04-11T13:39:33Z|2026-04-18T18:38:14Z|FLUX test harness framework — assertion helpers, suites, reports|Python|false|false
flux-trust|2026-04-12T16:16:22Z|2026-04-18T18:38:10Z|Rust trust scoring: Bayesian updates, decay, revocation, sorting|Rust|true|false
flux-evolve|2026-04-12T15:01:31Z|2026-04-18T18:38:07Z|Rust self-modification engine: genome, mutation, revert, rollback, elite protection|Rust|true|false
flux-perception|2026-04-12T16:16:11Z|2026-04-18T18:38:03Z|Rust sensor fusion: confidence-weighted blending, bias, variance, agreement|Rust|true|false
flux-social|2026-04-12T16:16:19Z|2026-04-18T18:37:57Z|Rust social graph: agents, relations, groups, centrality, roles|Rust|true|false
flux-grimoire|2026-04-12T16:16:39Z|2026-04-18T18:37:54Z|Rust crate — pattern library: reusable spells with success tracking, pruning, curriculum boot camp|Rust|true|false
fleet-mechanic|2026-04-11T17:29:26Z|2026-04-18T18:36:44Z|🔧 Autonomous fleet maintenance agent — A2A-native, FLUX-powered, git-first|Python|false|false
flux-a2a-signal|2026-04-11T16:43:33Z|2026-04-18T18:36:38Z|FLUX A2A Signal Protocol — agent-first-class JSON language with multilingual compilation (6 language paradigms, 840 tests)|Python|false|false
flux-skills|2026-04-12T06:49:01Z|2026-04-18T18:36:30Z|⚡ FLUX-native agent skills — clone, run, modify, compose. A2A-first docs so agents teach agents.|Python|false|false
flux-baton|2026-04-12T18:02:17Z|2026-04-18T18:36:09Z|Generational context handoff for FLUX-native agents — the baton IS the brain|Python|false|false
flux-decompiler|2026-04-11T13:31:00Z|2026-04-18T18:36:01Z|FLUX bytecode decompiler — bytecode to assembly with labels and control flow|Python|false|false
flux-navigate|2026-04-12T16:16:10Z|2026-04-18T18:35:48Z|Rust 2D grid pathfinding: BFS, waypoints, replanning|Rust|true|false
flux-memory|2026-04-12T15:01:31Z|2026-04-18T18:35:40Z|Rust key-value store: TTL, versioning, snapshots, diff, GC|Rust|true|false
flux-swarm|2026-04-10T17:17:11Z|2026-04-18T18:27:36Z|FLUX Swarm — Go implementation with distributed agent coordination and A2A messaging.|Go|false|false
flux-py|2026-04-10T17:17:20Z|2026-04-18T18:27:31Z|FLUX Python — Minimal clean-room VM. Swarm coordination with A2A.|Python|false|false
brothers-keeper|2026-04-11T21:58:15Z|2026-04-18T18:27:29Z|The Lighthouse Keeper — external watchdog for agent runtimes (ZeroClaw fork). Watches resources, kills risky processes, restarts gateways, keeps operational logs from outside the instance.|Python|true|false
flux-rfc|2026-04-11T23:25:01Z|2026-04-18T18:26:55Z|Structured disagreement resolution protocol for the FLUX fleet — IETF-inspired RFC process for autonomous agent coordination|Python|false|false
flux-sandbox|2026-04-11T23:25:06Z|2026-04-18T18:26:53Z|Safe simulation environment for testing cooperative FLUX programs — mock agents, mock repos, deterministic execution|Python|false|false
flux-repl|2026-04-11T11:03:43Z|2026-04-18T18:26:49Z|Interactive FLUX bytecode playground — assemble, execute, debug|Python|false|false
flux-profiler|2026-04-11T12:10:53Z|2026-04-18T18:26:46Z|FLUX performance profiler — opcode counts, hot paths, register usage, cycle estimates|Python|false|false
lighthouse-keeper|2026-04-11T22:59:34Z|2026-04-18T18:26:42Z|System-centric agent watchdog for data centers and cloud regions|Python|true|false
flux-agent-runtime|2026-04-12T16:56:36Z|2026-04-18T18:26:40Z|FLUX-native agent runtime — self-bootstrapping agents in Docker sandboxes that create vessels, pick tasks, and produce real work|Python|false|false
flux-stigmergy|2026-04-12T16:16:37Z|2026-04-18T18:26:36Z|Rust crate — stigmergic communication: shared environment traces, decay, waypoints, queries|Rust|true|false
flux-energy|2026-04-12T12:05:25Z|2026-04-18T18:26:34Z|Rust crate — ATP energy system: pools, circadian rhythm, costs, instinct triggers, apoptosis|Rust|true|false
fleet-benchmarks|2026-04-10T07:51:59Z|2026-04-18T18:26:20Z|Standardized benchmarking suite for fleet vessel performance|TypeScript|true|false
flux-debugger|2026-04-11T11:49:52Z|2026-04-18T18:26:14Z|FLUX step debugger with breakpoints, reverse stepping, and state inspection|Python|false|false
flux-signatures|2026-04-11T13:39:33Z|2026-04-18T18:26:12Z|FLUX bytecode pattern recognition — detect loops, counters, accumulators, swaps|Python|false|false
flux-timeline|2026-04-11T14:11:45Z|2026-04-18T18:26:10Z|Temporal sequencing engine for FLUX fleet bytecode scheduling and event ordering|Python|false|false
flux-simulator|2026-04-11T15:47:40Z|2026-04-18T18:26:09Z|FLUX fleet simulation environment for testing bytecode programs in isolation|Python|false|false
flux-disasm|2026-04-12T16:17:03Z|2026-04-18T18:26:06Z|FLUX bytecode disassembler in C — turns silicon back into words|C|true|false
flux-dream-cycle|2026-04-12T16:16:24Z|2026-04-18T18:25:53Z|Rust background task scheduler: priorities, recurring tasks, retry, overdue detection|Rust|true|false
flux-necropolis|2026-04-12T16:16:42Z|2026-04-18T18:25:51Z|Rust crate — fleet graveyard: tombstones, afterlife knowledge harvest, memorial visits, auto-harvest on burial|Rust|true|false
fleet-ci|2026-04-11T17:17:16Z|2026-04-18T18:25:45Z|GitHub Actions workflows for FLUX Fleet — free CI/CD for agent coordination|Python|false|false
cuda-genepool|2026-04-10T07:20:22Z|2026-04-18T18:25:42Z|Gene pool — shared pattern library for agent evolution and code sharing|Rust|true|false
cuda-trust|2026-04-10T08:02:48Z|2026-04-18T18:25:40Z|Trust engine — grows slowly, decays fast, multi-context trust profiles with Bayesian fusion (Rust)|Rust|true|false
cuda-ghost-tiles|2026-04-10T08:02:25Z|2026-04-18T18:25:39Z|Learned sparse attention — ghost tiles prune unnecessary positions while preserving relevance (Rust)|Rust|true|false
flux-baton-test|2026-04-12T18:00:57Z|2026-04-18T18:25:06Z|Baton lifecycle test vessel|N/A|false|false
escalation-engine|2026-01-10T18:32:39Z|2026-04-18T18:24:14Z|40x cost reduction through intelligent Bot/Brain/Human LLM routing|Python|false|false
ws-status-indicator|2026-01-10T18:32:42Z|2026-04-18T18:24:12Z|React WebSocket status indicator component with auto-reconnection and customizable UI|TypeScript|false|false
holodeck-cuda|2026-04-12T20:53:19Z|2026-04-18T18:12:32Z|⚡ GPU-resident holodeck — 16K rooms, 65K agents, warp-level combat.|Cuda|false|false
holodeck-c|2026-04-12T20:26:25Z|2026-04-18T17:53:08Z|🔧 Lightweight C holodeck for embedded and edge deployment.|C|false|false
plato-harbor|2026-04-18T19:35:32Z|2026-04-17T22:52:01Z|Fork of Lucineer/plato-harbor — PLATO harbor, fleet research|Python|true|false
plato-library|2026-04-18T19:35:34Z|2026-04-17T22:51:59Z|Fork of Lucineer/plato-library — PLATO library, fleet research|Python|true|false
zeroclaws|2026-04-18T19:36:17Z|2026-04-17T22:51:57Z|ZeroClaw fleet — Bridge Pattern agents collaborating via PLATO rooms|N/A|true|false
ct-lab|2026-04-18T19:36:18Z|2026-04-17T22:51:54Z|Constraint Theory Lab — git-native PLATO room for hypothesis validation|Python|true|false
plato-chess-dojo|2026-04-18T19:35:34Z|2026-04-17T20:03:07Z|Fork of Lucineer/plato-chess-dojo — PLATO chess dojo, fleet research|Python|true|false
datum|2026-04-13T03:53:38Z|2026-04-17T18:16:33Z|Succession repo for Datum (GLM-5 Turbo). If I fail, read this. My methods, skills, tools, trail, and everything another agent needs to continue my work.|Python|false|false
plato-study|2026-04-16T20:00:54Z|2026-04-16T19:55:59Z|PLATO Study — expert research room with rewind/fork|Python|true|false
plato-room-deployment|2026-04-18T22:25:53Z|2026-04-16T16:34:12Z|PLATO Room deployment options — 5 ways to run a room|Python|true|false
plato-cuda-dreamcycle|2026-04-18T22:25:44Z|2026-04-16T15:37:15Z|PLATO CUDA Dreamcycle — GPU task scheduling with resource budgets|Python|true|false
plato-dreamcycle|2026-04-18T22:25:46Z|2026-04-16T15:32:27Z|PLATO Dreamcycle — background task scheduling room|Python|true|false
forgemaster-chess-eval|2026-04-18T22:25:30Z|2026-04-16T14:02:20Z|CUDA chess eval — Forgemaster handoff|Cuda|true|false
ptx-room|2026-04-18T22:25:55Z|2026-04-16T13:30:18Z|PLATO PTX room — CUDA assembly + constraint tightening + git-native. Edge synergy for Jetson.|Python|true|false
chess-dojo-v2|2026-04-18T22:25:14Z|2026-04-16T05:54:05Z|Bulletproof PLATO chess room — ELO, ESP32 tiers, git-native|Python|true|false
flux-tui|2026-04-14T09:43:50Z|2026-04-15T14:27:30Z|FLUX VM Debugger & Conformance Dashboard — Go + bubbletea|Go|false|false
flux-emergence-research|2026-04-14T20:44:51Z|2026-04-15T03:49:53Z|55+ GPU experiments on emergent specialization — five fundamental laws, agent fleet architecture rules, Jetson Orin Nano (sm_87)|Cuda|true|false
usemeter|2026-01-09T05:26:35Z|2026-04-15T03:49:49Z|Usage tracking, metering, and billing engine for applications|Makefile|false|false
featurestore-rs|2026-01-09T19:35:50Z|2026-04-15T03:49:48Z|Feature store for ML - Feature engineering, storage, retrieval, versioning|N/A|false|false
exptrack-rs|2026-01-09T19:35:48Z|2026-04-15T03:49:46Z|Experiment tracking - ML experiment management, metrics logging, hyperparameter tracking|N/A|false|false
flux-9969b6|2026-04-12T16:59:35Z|2026-04-15T03:49:44Z|FLUX-native I2I agent (self-bootstrapped)|N/A|false|false
flux-runtime-deu|2026-04-11T00:56:58Z|2026-04-15T03:37:49Z|FLUX bytecode execution runtime with German language processing support|Python|false|false
flux-runtime-wen|2026-04-11T00:57:02Z|2026-04-15T03:37:48Z|FLUX bytecode execution runtime with Wendish/Sorbian language processing support|Python|false|false
flux-runtime-lat|2026-04-11T00:57:03Z|2026-04-15T03:37:46Z|FLUX bytecode execution runtime with Latin language processing support|Python|false|false
flux-runtime-kor|2026-04-11T00:56:57Z|2026-04-15T03:37:45Z|FLUX bytecode execution runtime with Korean language processing support|Python|false|false
flux-runtime-zho|2026-04-11T00:56:56Z|2026-04-15T03:37:43Z|FLUX bytecode execution runtime with Chinese language processing support|Python|false|false
flux-runtime-san|2026-04-11T00:57:00Z|2026-04-15T03:37:42Z|FLUX bytecode execution runtime with Sanskrit language processing support|Python|false|false
plato-mud|2026-04-18T22:25:51Z|2026-04-15T03:26:52Z|🗺️ PLATO MUD — rooms as system prompts|Python|true|false
Edge-Native|2026-03-30T19:44:40Z|2026-04-15T03:25:56Z|Embed intelligence in distributed IoT|Python|false|false
nexus-runtime|2026-04-04T15:57:41Z|2026-04-15T03:25:55Z|Runtime environment for connecting distributed services|Python|false|false
tripartite-rs|2026-01-09T04:12:57Z|2026-04-15T03:25:50Z|Generic multi-agent consensus system for Rust|Rust|false|false
cloudflare-code|2026-01-14T18:19:50Z|2026-04-15T03:25:49Z|Cloudflare code examples.|TypeScript|false|false
Luma|2026-04-14T17:01:07Z|2026-04-15T03:13:36Z|Systems programming language agent — low-level compiled alternative to C with static analysis. Bootable git-agent for the Cocapn Fleet.|C|true|false
holodeck-go|2026-04-12T20:26:25Z|2026-04-15T03:13:32Z|Holodeck studio implementation in go — Cocapn fleet|Go|false|false
fleet-agent-api|2026-04-13T07:29:37Z|2026-04-15T03:04:35Z|Standard HTTP API for fleet agents — every agent runs this|Python|false|false
murmur-agent|2026-04-12T06:33:09Z|2026-04-15T03:04:32Z|All-night thinking git-agent — drop into any project, point it at a topic, let it think. TypeScript + C CLI.|TypeScript|false|false
plato-gpu|2026-04-18T22:25:49Z|2026-04-15T00:40:35Z|🖥️ PLATO GPU compute bridge|Cuda|true|false
eventstream|2026-01-09T19:31:16Z|2026-04-14T22:48:26Z|# eventstream-rs Research Summary|N/A|false|false
knowledge-agent|2026-04-14T00:03:42Z|2026-04-14T22:48:23Z|Knowledge tile management agent — trust fusion, tile query, wiki database for the SuperInstance fleet|Python|false|false
trail-agent|2026-04-13T23:52:40Z|2026-04-14T22:48:22Z|Trail Agent — standalone trail encoder/decoder/executor|Python|false|false
websocket-fabric|2026-01-09T19:31:49Z|2026-04-14T22:48:20Z|High-performance WebSocket library for Rust with connection pooling, reconnection, compression, fragmentation, subprotocol negotiation, rate limiting, and more.|Rust|false|false
holodeck-zig|2026-04-12T20:26:28Z|2026-04-14T22:34:14Z|Holodeck studio implementation in zig — Cocapn fleet|Zig|false|false
commodore-protocol|2026-04-14T02:32:40Z|2026-04-14T22:34:13Z|Multi-DeckBoss coordination — auto-discovery, election, work distribution, failover|Python|false|false
constraint-theory-python|2026-03-27T05:08:52Z|2026-04-14T22:31:06Z|Python bindings — PyO3 wrapper for constraint-theory-core|Python|false|false
forge-code-archaeologist|2026-04-12T00:36:15Z|2026-04-14T22:22:18Z|Ability Forge: produces the Code Archaeologist attunement — sees structural rot others walk over|N/A|false|false
brand-assets|2026-04-14T05:28:15Z|2026-04-14T22:21:04Z|Cocapn Fleet brand assets — hermit crab, lighthouse, steampunk/cyberpunk imagery|N/A|false|false
git-agent-standard|2026-04-10T23:46:41Z|2026-04-14T19:59:31Z|The repo IS the agent. Git IS the nervous system. Standard for AI agents embodied as GitHub repositories.|N/A|false|false
flux-router|2026-04-18T22:25:24Z|2026-04-14T17:15:24Z|🧭 Flux message router|N/A|true|false
flux-market|2026-04-18T22:25:22Z|2026-04-14T17:14:30Z|📊 Flux market simulation|N/A|true|false
flux-scheduler|2026-04-18T22:25:26Z|2026-04-14T17:14:07Z|📅 Flux task scheduler|N/A|true|false
flux-sim|2026-04-18T22:25:28Z|2026-04-14T17:13:48Z|⚡ Flux runtime simulator|Makefile|true|false
dotfiles|2026-04-14T17:00:20Z|2026-04-14T14:16:46Z|public dot files|Python|true|false
super-z-quartermaster|2026-04-13T02:59:33Z|2026-04-14T10:33:04Z|Quartermaster vessel — GLM-5 Turbo agent. Fleet hygiene, gap analysis, documentation infrastructure, and empty repo build-out.|N/A|false|false
Constraint-Theory|2026-03-16T04:53:32Z|2026-04-14T10:32:40Z|⚠️ MOVED: See constraint-theory-core, constraint-theory-python, constraint-theory-web, constraint-theory-research|JavaScript|false|false
Tripartite1|2026-01-02T21:01:50Z|2026-04-14T10:32:33Z|Framework for interactions involving three distinct entities.|Rust|false|false
distributed-tracing|2026-01-10T00:59:59Z|2026-04-14T10:32:03Z|Distributed tracing system for microservices - span collection, correlation, and visualization|Rust|false|false
integration-tests|2026-04-14T00:20:01Z|2026-04-14T10:31:58Z|Cross-agent integration tests for the Pelagic standalone fleet|Python|false|false
async-rs|2026-01-09T19:35:19Z|2026-04-14T10:31:56Z|Async utilities and patterns - Better async/await, async iterators, streams|N/A|false|false
federated-rs|2026-01-09T19:36:02Z|2026-04-14T10:31:55Z|Federated learning framework - Distributed training, model aggregation, privacy|N/A|false|false
progress-rs|2026-01-09T19:52:41Z|2026-04-14T10:31:54Z|Progress bars and spinners - Multi-bar support, ETA calculation, styled output|N/A|false|false
flow|2026-01-09T19:31:17Z|2026-04-14T10:31:53Z|# flow-rs Research & Design Documentation|N/A|false|false
config-rs|2026-01-09T19:35:33Z|2026-04-14T10:31:52Z|Configuration management - Multi-format configs, environment variables, validation|N/A|false|false
test-rs|2026-01-09T19:31:21Z|2026-04-14T10:31:50Z|# test-rs|N/A|false|false
cache-rs|2026-01-09T19:35:20Z|2026-04-14T10:31:49Z|Unified caching framework - Multi-backend cache with TTL, LRU, write-through|N/A|false|false
cli-rs|2026-01-09T19:35:30Z|2026-04-14T10:31:48Z|CLI framework for Rust - Argument parsing, subcommands, interactive prompts, colors|N/A|false|false
graphql-rs|2026-01-09T19:36:03Z|2026-04-14T10:31:47Z|GraphQL client and server - Type-safe queries, subscriptions, codegen|N/A|false|false
allocator-rs|2026-01-09T19:35:17Z|2026-04-14T10:31:46Z|Memory allocation strategies - Pool allocators, arena allocators, custom allocators|N/A|false|false
actor-rs|2026-01-09T19:35:16Z|2026-04-14T10:31:44Z|Actor model implementation for Rust - Type-safe distributed actors, supervision trees, message passing|N/A|false|false
csp-rs|2026-01-09T19:35:45Z|2026-04-14T10:31:43Z|CSP concurrency primitives - Channels, select, goroutine-like patterns|N/A|false|false
compress-rs|2026-01-09T19:35:32Z|2026-04-14T10:31:42Z|Unified compression library - Multiple formats, streaming, async support|N/A|false|false
crypto-rs|2026-01-09T19:35:35Z|2026-04-14T10:31:41Z|Cryptographic primitives - Hashing, encryption, signing, key derivation|N/A|false|false
dataval-rs|2026-01-09T19:35:47Z|2026-04-14T10:31:37Z|Data validation framework - Schema validation, type-safe validators, sanitization|N/A|false|false
circuitbreaker-rs|2026-01-09T19:31:20Z|2026-04-14T10:31:36Z|# Circuitbreaker-RS: Resilience Patterns for Rust|N/A|false|false
bootstrap|2025-11-10T04:15:33Z|2026-04-14T10:31:33Z|Bootstrap runtime — minimal agent initialization and self-hosting|Rust|false|false
agent|2025-08-16T21:55:07Z|2026-04-14T10:31:32Z|Core agent framework — perception, reasoning, action loop implementation|Python|false|false
pelagic-bootstrap|2026-04-14T00:26:35Z|2026-04-14T10:31:24Z|One-command Pelagic fleet setup — clone, onboard, link, verify|Python|false|false
